31050774,"EXAUST BOSCH CHAM.60C.S/MO-DWB060D50",11,BOSCH,1,"GRANDES DOMÉSTICOS",80,"ENCASTRE - EXAUSTOR/EXTRATORES",800083,"EXAUST.DE CHAMINÉ                                 ",",00","362,90","244,21",não,não,não,sim,DWB060D50,"4242002922300 ",0,0,0,0,0,"http://services.sorefoz.pt/redes/imgredes2.aspx?IMG=31050774 ","Filtro: Metálico  <BR>Altura: 80 / 124,5 cm<BR>Largura: 59,8 cm<BR>Profundidade: 47 cm<BR>Cor: Inox  <BR>Garantia: 2 anos<BR>-","Filtro:Metálico <br>Altura:80 / 124,5 cm<br>Largura:59,8 cm<br>Profundidade:47 cm<br>Cor:Inox <br>Características:Ligação a um sistema de ventilação central<BR>Sem motor<BR>Com controlo de válvula<BR>Filtro lavável na M.L.L. <br>Garantia:2 anos<br>",,,Não,
31050775,"ENC.COMBI BOSCH 273L.NF. -KIN86AF30F",11,BOSCH,1,"GRANDES DOMÉSTICOS",120,"ENCASTRE - FRIO",1200122,"COMBINADOS                                        ",",00","1.240,90","835,38",não,não,não,não,KIN86AF30F,"4242002983981 ","68,38","750,915",1850,615,660,"http://services.sorefoz.pt/redes/imgredes2.aspx?IMG=31050775 ","Capacidade: 273 Litros<BR>Capacidade Refrigerador: 187 Litros<BR>Capacidade Congelador: 67 Litros<BR>Consumo: 221 kWh/ano<BR>Classe Energética: A&#43 &#43   <BR>Capacidade de Congelação: 8 Kg/24h<BR>Autonomia: 13 horas<BR>Tecnologia: No Frost  <BR>Altura: 177,2 cm<BR>Largura: 55,8 cm<BR>Profundidade: 54,5 cm<BR>Cor: Branco  <BR>Garantia: 2 anos<BR>-","Capacidade:273 Litros<br>Capacidade Refrigerador:187 Litros<br>Capacidade Congelador:67 Litros<br>Consumo:221 kWh/ano<br>Classe Energética:A++ <br>Capacidade de Congelação:8 Kg/24h<br>Autonomia:13 horas<br>Tecnologia:No Frost <br>Altura:177,2 cm<br>Largura:55,8 cm<br>Profundidade:54,5 cm<br>Cor:Branco <br>Características:Controlo eletrónico da temperatura com regulação digital exata<BR>FreshSense: temperatura constante através de sensores inteligentes<BR>Função Férias<BR>Super refrigeração<BR>5 prateleiras vidro<BR>5 prateleiras na porta<BR>Gaveta VitaFresh<BR>Iluminação interior por LEDs<BR>Super congelação com desligar automático<BR>3 gavetas transparentes, incluindo 1 BigBox<BR>Vario Zone: prateleiras de vidro extraíveis<BR>Alarme ótico e acústico<BR>Pés frontais ajustáveis <br>Garantia:2 anos<br>",A++,http://services.sorefoz.pt/redes/mostraretiqenerg.aspx?fich=31050775,Sim,
31050776,"ENC.FRIGO BOSCH 1P.215L.++ -KIR41AF30",11,BOSCH,1,"GRANDES DOMÉSTICOS",120,"ENCASTRE - FRIO",1200123,"FRIGORIFICOS                                      ",",00","704,78","474,07",sim,não,não,não,KIR41AF30,"4242002735252 ","52,12","523,278",652,615,1305,"http://services.sorefoz.pt/redes/imgredes2.aspx?IMG=31050776 ","Capacidade: 215 Litros<BR>Consumo: 105 kWh/ano<BR>Classe Energética: A&#43 &#43   <BR>Altura: 122,1 cm<BR>Largura: 55,8 cm<BR>Profundidade: 54,5 cm<BR>Cor: Branco  <BR>Garantia: 2 anos<BR>-","Capacidade:215 Litros<br>Consumo:105 kWh/ano<br>Classe Energética:A++ <br>Altura:122,1 cm<br>Largura:55,8 cm<br>Profundidade:54,5 cm<br>Cor:Branco <br>Características:Visualização e controlo eletrónico da temperatura, através visor digital<BR>FreshSense: temperatura constante através de sensores inteligentes<BR>Descongelação automática<BR>Super refrigeração<BR>6 prateleiras de vidro<BR>4 prateleiras na porta<BR>Gaveta VitaFresh Plus com railes telescópicos e controlo de humidade<BR>Iluminação interior por LEDs<BR>Alarme acústico de porta aberta <br>Garantia:2 anos<br>",A++,http://services.sorefoz.pt/redes/mostraretiqenerg.aspx?fich=31050776,Sim,
31050777,"ENC.C.V BOSCH 73L.3G3C3A++ -GIV11AF30",11,BOSCH,1,"GRANDES DOMÉSTICOS",120,"ENCASTRE - FRIO",1200121,"CONGELADORES VERTICAIS                            ",",00","609,90","410,31",não,não,não,não,GIV11AF30,"4242002923819 ","37,6","304,512",780,610,640,"http://services.sorefoz.pt/redes/imgredes2.aspx?IMG=31050777 ","Capacidade Congelador: 73 Litros<BR>Classe Energética: A&#43 &#43   <BR>Consumo: 144 kWh/ano<BR>Capacidade de Congelação: 8 Kg/24h<BR>Tecnologia: LowFrost  <BR>Autonomia: 21 horas<BR>Altura: 71,2 cm<BR>Largura: 55,8 cm<BR>Profundidade: 54,5 cm<BR>Cor: Branco  <BR>Garantia: 2 anos<BR>-","Capacidade Congelador:73 Litros<br>Classe Energética:A++ <br>Consumo:144 kWh/ano<br>Capacidade de Congelação:8 Kg/24h<br>Tecnologia:LowFrost <br>Autonomia:21 horas<br>Altura:71,2 cm<br>Largura:55,8 cm<br>Profundidade:54,5 cm<br>Cor:Branco <br>Características:Regulação eletrónica da temperatura, através de visor de LEDs<BR>Super congelação com desligar automático<BR>3 gavetas transparentes<BR>Alarme acústico e visual <br>Garantia:2 anos<br>",A++,http://services.sorefoz.pt/redes/mostraretiqenerg.aspx?fich=31050777,Sim,
31050778,"ENC.MLL BOSCH 6P.TI.C.A++ -SMV46IX02E",11,BOSCH,1,"GRANDES DOMÉSTICOS",150,"ENCASTRE - MAQ.LOUÇA",1500151,"MAQ.LAVAR LOUÇA 60 Cm                             ",",00","813,90","547,42",não,não,não,não,SMV46IX02E,"4242002973654 ",37,"385,468",683,645,875,"http://services.sorefoz.pt/redes/imgredes2.aspx?IMG=31050778 ","Capacidade: 13 Talheres<BR>Nº de Programas: 6  <BR>Nº de Temperaturas: 5  <BR>Classe Energética: A&#43 &#43   <BR>Eficiência Secagem: A  <BR>Consumo de Água: 9,5 Lts<BR>Altura: 81,5 cm<BR>Largura: 59,8 cm<BR>Profundidade: 55 cm<BR>Garantia: 2 anos<BR>-","Capacidade:13 Talheres<br>Nº de Programas:6 <br>Nº de Temperaturas:5 <br>Classe Energética:A++ <br>Eficiência Secagem:A <br>Consumo de Água:9,5 Lts<br>Altura:81,5 cm<br>Largura:59,8 cm<br>Profundidade:55 cm<br>Características:Programação diferida até 24 h<BR>Indicador de tempo restante<BR>Indicação eletrónica falta de sal e abrilhantador<BR>3 funções especiais: VarioSpeed Plus, HigienePlus e Bitérmico<BR>Sistema hidráulico ActiveWater<BR>Assistente de dosagem<BR>AquaSwitch<BR>AquaSensor, sensor de carga<BR>Identificação automática do tipo de detergente<BR>Regeneração eletrónica<BR>Sistema GlassProtec<BR>Cesto superior regulável em altura com Rackmatic<BR>Proteção contra vapores<BR>AquaStop <br>Garantia:2 anos<br>",A++,http://services.sorefoz.pt/redes/mostraretiqenerg.aspx?fich=31050778,Não,
31050779,"EXAUST BOSCH CHAM.TECTO-IX-DID09T951",11,BOSCH,1,"GRANDES DOMÉSTICOS",80,"ENCASTRE - EXAUSTOR/EXTRATORES",800083,"EXAUST.DE CHAMINÉ                                 ",",00","1.272,90","882,97",não,não,não,sim,DID09T951,"4242002834405 ","12,323","250,175",622,1042,386,"http://services.sorefoz.pt/redes/imgredes2.aspx?IMG=31050779 ","Aspiração/Extracção: 780 m3/hora<BR>Ef. fluído dinâmica: A  <BR>Ef. iluminação: A  <BR>Ef. filtragem gordura: E  <BR>Nº de Velocidades: 4  <BR>Classe Energética: A  <BR>Consumo: 58,2 kWh/ano<BR>Nº de Motores: 1  <BR>Nº de Lâmpadas: 4  <BR>Filtro: Metálico  <BR>Nível de Ruído: 64 dB<BR>Altura: 29,9 cm<BR>Largura: 90 cm<BR>Profundidade: 50 cm<BR>Cor: Inox  <BR>Garantia: 2 anos<BR>Acessórios Incluídos: Controlo remoto  <BR>-","Aspiração/Extracção:780 m3/hora<br>Ef. fluído dinâmica:A <br>Ef. iluminação:A <br>Ef. filtragem gordura:E <br>Nº de Velocidades:4 <br>Classe Energética:A <br>Consumo:58,2 kWh/ano<br>Nº de Motores:1 <br>Nº de Lâmpadas:4 <br>Filtro:Metálico <br>Nível de Ruído:64 dB<br>Altura:29,9 cm<br>Largura:90 cm<br>Profundidade:50 cm<br>Cor:Inox <br>Características:Controlo eletrónico<BR>Teclas com iluminação<BR>Indicação de 7 segmentos<BR>Aspiração perimetral<BR>Nível intensivo com retorno automático para nível inferior após 10 minutos<BR>Funcionamento automático em intervalos programados<BR>Iluminação LED<BR>Desliga-se automaticamente depois de 10 minutos<BR>Indicação do grau de saturação do filtro metálico <br>Garantia:2 anos<br>Acessórios Incluídos:Controlo remoto <br>",A,http://services.sorefoz.pt/redes/mostraretiqenerg.aspx?fich=31050779,Não,
31050780,"MODULO BOSCH RECIRCULAÇÃO   -DSZ4565",11,BOSCH,9,"ACESSÓRIOS E BATERIAS",900,"ACESSÓRIOS E BATERIAS",9000902,"ACESSÓRIOS                                        ",",00","50,90","33,75",não,não,não,não,DSZ4565,"4242002882314 ","0,534","6,381",206,484,64,"http://services.sorefoz.pt/redes/imgredes2.aspx?IMG=31050780 ","Características: Módulo para recirculação standard para DFS097A50, DFS0674A50  <BR>Acessórios Incluídos: Filtro  <BR>Garantia: 2 anos<BR>-","Características:Módulo para recirculação standard para DFS097A50, DFS0674A50 <br>Acessórios Incluídos:Filtro <br>Garantia:2 anos<br>",,,Não,
31050782,"FRISO BOSCH UNIÃO P/SBS   -KSZ39AL00",11,BOSCH,1,"GRANDES DOMÉSTICOS",170,"ENCASTRE - OUTRAS",1700179,"ACESSORIOS ENCASTRE                               ",",00","50,90","33,75",não,não,não,não,KSZ39AL00,"4242002961156 ","0,855","10,05",50,2010,100,"http://services.sorefoz.pt/redes/imgredes2.aspx?IMG=31050782 ","Cor: Inox  <BR>Garantia: 2 anos<BR>-","Cor:Inox <br>Características:Friso união Side-By-Side (KSV36AI40 + GSN36AI30, KSV36VI30 + GSN36VI30, KSV36VI30 + GSN36VI30, KSV33VL30 + GSN33VL30)<BR>Adicionalmente para colocar combinados no frost com puxadores salientes, com portas inox ou design inox com nova tecnologia do condensador (FSCT) em side-by-side <br>Garantia:2 anos<br>",,,Não,
31050783,"KIT BOSCH P/RECIRCUL.STAND-DWZ0AK0R0",11,BOSCH,1,"GRANDES DOMÉSTICOS",170,"ENCASTRE - OUTRAS",1700179,"ACESSORIOS ENCASTRE                               ",",00","376,90","253,15",não,não,não,não,DWZ0AK0R0,"4242002966472 ",0,0,0,0,0,"http://services.sorefoz.pt/redes/imgredes2.aspx?IMG=31050783 ","Características: Módulo para recirculação standard<BR>DWK98PR60, DWK98PR20, DWK97IM60, DWK97IM20, DWK67IM60, DWK67IM20 (instalação sem chaminé)  <BR>Garantia: 2 anos<BR>-","Características:Módulo para recirculação standard<BR>DWK98PR60, DWK98PR20, DWK97IM60, DWK97IM20, DWK67IM60, DWK67IM20 (instalação sem chaminé) <br>Garantia:2 anos<br>",,,Não,
31050784,"MODULO BOSCH RECIRCULAÇÃO   -DSZ4545",11,BOSCH,9,"ACESSÓRIOS E BATERIAS",900,"ACESSÓRIOS E BATERIAS",9000902,"ACESSÓRIOS                                        ",",00","50,90","33,75",não,não,não,não,DSZ4545,"4242002882284 ","0,4","6,84",180,200,190,"http://services.sorefoz.pt/redes/imgredes2.aspx?IMG=31050784 ","Características: Módulo para recirculação standard para DFM064W52, DFM064W50  <BR>Garantia: 2 anos<BR>-","Características:Módulo para recirculação standard para DFM064W52, DFM064W50 <br>Garantia:2 anos<br>",,,Não,
31050785,"ENC.RAILE BOSCH TELESCOPIC-HEZ638D30",11,BOSCH,1,"GRANDES DOMÉSTICOS",170,"ENCASTRE - OUTRAS",1700179,"ACESSORIOS ENCASTRE                               ",",00","141,90","94,93",não,não,não,não,HEZ638D30,"4242002810195 ",0,0,0,0,0,"http://services.sorefoz.pt/redes/imgredes2.aspx?IMG=31050785 ","Características: Raile telescópico de 3 níveis<BR>Válido para todos os fornos 60 m com vapor Serie 8  <BR>Garantia: 2 anos<BR>-","Características:Raile telescópico de 3 níveis<BR>Válido para todos os fornos 60 m com vapor Serie 8 <br>Garantia:2 anos<br>",,,Não,
31050786,"KIT BOSCH P/RECIRCUL.CLEANAI-DSZ6240",11,BOSCH,1,"GRANDES DOMÉSTICOS",170,"ENCASTRE - OUTRAS",1700179,"ACESSORIOS ENCASTRE                               ",",00","210,90","142,06",não,não,não,sim,DSZ6240,"4242002755366 ",0,0,0,0,0,"http://services.sorefoz.pt/redes/imgredes2.aspx?IMG=31050786 ","Características: Módulo para recirculação CleanAir<BR>DWB121K50, DWB091K50, DWB091E51, DWB098J50, DWW098E50, DWB097E51 e DWB097A50  <BR>Garantia: 2 anos<BR>-","Características:Módulo para recirculação CleanAir<BR>DWB121K50, DWB091K50, DWB091E51, DWB098J50, DWW098E50, DWB097E51 e DWB097A50 <br>Garantia:2 anos<br>",,,Não,
31050787,"ENC.MESA BOSCH VC.4Z.INDU-PVS631BB1E",11,BOSCH,1,"GRANDES DOMÉSTICOS",70,"ENCASTRE - MESAS",700073,"DE INDUÇÃO                                        ",",00","551,90","372,09",não,não,não,sim,PVS631BB1E,"4242002861722 ","12,52","59,871",130,610,755,"http://services.sorefoz.pt/redes/imgredes2.aspx?IMG=31050787 ","Tipo de Mesa: Indução  <BR>Queimadores/Zonas: 4 Z  <BR>Potência: 6900 W<BR>Comandos: Frontais  <BR>Altura: 5,1 cm<BR>Largura: 59,2 cm<BR>Profundidade: 52,2 cm<BR>Cor: Preto  <BR>Garantia: 2 anos<BR>-","Tipo de Mesa:Indução <br>Queimadores/Zonas:4 Z <br>Potência:6900 W<br>Comandos:Frontais <br>Altura:5,1 cm<br>Largura:59,2 cm<br>Profundidade:52,2 cm<br>Cor:Preto <br>Características:CombiZone<BR>Controlo TouchSelect<BR>17 níveis de potência<BR>Visor digital 7 segmentos<BR>Programação do tempo de cozedura para todas as zonas com função desligar<BR>Sinal sonoro de fim de tempo<BR>Função QuickStart<BR>Função Restart<BR>Função PowerBoost em todas as zonas<BR>2 níveis de indicadores de calor residual para cada zona<BR>Deteção do recipiente<BR>Limitação da potência da placa<BR>Desligar de segurança<BR>Bloqueio de segurança para crianças<BR>Frente biselada <br>Garantia:2 anos<br>",,,Não,
31050788,"ENC.MESA BOSCH VC.4Z.INDU-PIE651BB1E",11,BOSCH,1,"GRANDES DOMÉSTICOS",70,"ENCASTRE - MESAS",700073,"DE INDUÇÃO                                        ",",00","528,90","355,45",não,não,não,não,PIE651BB1E,"4242002870298 ",15,"52,44",750,608,115,"http://services.sorefoz.pt/redes/imgredes2.aspx?IMG=31050788 ","Tipo de Mesa: Indução  <BR>Queimadores/Zonas: 4 Z  <BR>Potência: 7400 W<BR>Comandos: Frontais  <BR>Altura: 5,1 cm<BR>Largura: 59,2 cm<BR>Profundidade: 52,2 cm<BR>Cor: Preto  <BR>Garantia: 2 anos<BR>-","Tipo de Mesa:Indução <br>Queimadores/Zonas:4 Z <br>Potência:7400 W<br>Comandos:Frontais <br>Altura:5,1 cm<br>Largura:59,2 cm<br>Profundidade:52,2 cm<br>Cor:Preto <br>Características:Controlo TouchSelect<BR>17 níveis de potência<BR>Visor digital 7 segmentos<BR>Programação do tempo de cozedura para todas as zonas com função desligar<BR>Sinal sonoro de fim de tempo<BR>Função QuickStart<BR>Função Restart<BR>Função PowerBoost em todas as zonas<BR>2 níveis de indicadores de calor residual para cada zona<BR>Deteção do recipiente<BR>Limitação da potência da placa<BR>Desligar de segurança<BR>Bloqueio de segurança para crianças<BR>Biselada <br>Garantia:2 anos<br>",,,Não,
31050789,"ENC.COMBI BOSCH 273L.NF.++ -KIN86VS30",11,BOSCH,1,"GRANDES DOMÉSTICOS",120,"ENCASTRE - FRIO",1200122,"COMBINADOS                                        ",",00","1.051,77","707,91",não,não,não,não,KIN86VS30,"4242002838946 ","67,85","733,525",1850,610,650,"http://services.sorefoz.pt/redes/imgredes2.aspx?IMG=31050789 ","Capacidade: 273 Litros<BR>Capacidade Refrigerador: 188 Litros<BR>Capacidade Congelador: 67 Litros<BR>Consumo: 222 kWh/ano<BR>Classe Energética: A&#43 &#43   <BR>Capacidade de Congelação: 8 Kg/24h<BR>Autonomia: 13 horas<BR>Tecnologia: No Frost  <BR>Altura: 177,2 cm<BR>Largura: 54,1 cm<BR>Profundidade: 54,5 cm<BR>Cor: Branco  <BR>Acessórios Incluídos: 2 acumuladores de frio<BR>Suporte ovos<BR>Cuvete para cubos de gelo  <BR>Garantia: 2 anos<BR>-","Capacidade:273 Litros<br>Capacidade Refrigerador:188 Litros<br>Capacidade Congelador:67 Litros<br>Consumo:222 kWh/ano<br>Classe Energética:A++ <br>Capacidade de Congelação:8 Kg/24h<br>Autonomia:13 horas<br>Tecnologia:No Frost <br>Altura:177,2 cm<br>Largura:54,1 cm<br>Profundidade:54,5 cm<br>Cor:Branco <br>Características:Visualização e controlo eletrónico da temperatura, através de visor digital<BR>FreshSense: temperatura constante através da tecnologia de sensores inteligentes<BR>4 prateleiras de vidro<BR>4 prateleiras na porta<BR>Gaveta para legumes<BR>Iluminação interior por LED´s<BR>Super congelação com desligar automático<BR>VarioZone: prateleiras de vidro removíveis<BR>3 gavetas transparentes, incluindo 1 BigBox <br>Acessórios Incluídos:2 acumuladores de frio<BR>Suporte ovos<BR>Cuvete para cubos de gelo <br>Garantia:2 anos<br>",A++,http://services.sorefoz.pt/redes/mostraretiqenerg.aspx?fich=31050789,Sim,
31050790,"ENC.MLL BOSCH 5P.45CM.CA+ -SPV45CX01E",11,BOSCH,1,"GRANDES DOMÉSTICOS",150,"ENCASTRE - MAQ.LOUÇA",1500152,"MAQ.LAVAR LOUÇA 45 Cm                             ",",00","600,90","416,47",não,não,não,sim,SPV45CX01E,"4242005074990 ",30,"226,1",680,500,665,"http://services.sorefoz.pt/redes/imgredes2.aspx?IMG=31050790 ","Capacidade: 9 Talheres<BR>Nº de Programas: 5  <BR>Nº de Temperaturas: 3  <BR>Classe Energética: A&#43   <BR>Classe Energética: A&#43   <BR>Eficiência Secagem: A  <BR>Consumo de Água: 8,5 Lts<BR>Altura: 81,5 cm<BR>Largura: 44,8 cm<BR>Profundidade: 55 cm<BR>Garantia: 2 anos<BR>-","Capacidade:9 Talheres<br>Nº de Programas:5 <br>Nº de Temperaturas:3 <br>Classe Energética:A+ <br>Classe Energética:A+ <br>Eficiência Secagem:A <br>Consumo de Água:8,5 Lts<br>Altura:81,5 cm<br>Largura:44,8 cm<br>Profundidade:55 cm<br>Características:Sistema hidráulico ActiveWater<BR>Assistente de dosagem<BR>AquaSensor, sensor de carga<BR>Identificação automática do tipo de detergente<BR>Função especial: VarioSpeedPlus<BR>Regeneração eletrónica<BR>Indicador de tempo restante<BR>Indicação eletrónica de falta de sal e abrilhantador<BR>Programação diferida até 24 horas<BR>Proteção contra vapores<BR>Sistema GlassProtec<BR>Cesto superior regulável em altura<BR>AquaStop com garantia vitalícia <br>Garantia:2 anos<br>",A+,http://services.sorefoz.pt/redes/mostraretiqenerg.aspx?fich=31050790,Não,
31050791,"ENC.FORNO BOSCH MF.PIRO.IX-HBA5785S0",11,BOSCH,1,"GRANDES DOMÉSTICOS",90,"ENCASTRE - FORNOS",900094,"PIROLITICOS                                       ",",00","715,90","482,37",não,não,não,sim,HBA5785S0,"4242005056712 ","41,7","293,6",672,657,665,"http://services.sorefoz.pt/redes/imgredes2.aspx?IMG=31050791 ","Forno: Multifunções  <BR>Capacidade do Forno: 71 Litros<BR>Nº de Programas: 10  <BR>Sist. de Limpeza: Pirolítica com 3 níveis: Eco, Normal e Plus  <BR>Classe Energética: A  <BR>Potência: 3600 W<BR>Altura: 59,5 cm<BR>Largura: 59,4 cm<BR>Profundidade: 54,8 cm<BR>Cor: Inox  <BR>Acessórios Incluídos: Grelha<BR>Assadeira universal  <BR>Garantia: 2 anos<BR>-","Forno:Multifunções <br>Capacidade do Forno:71 Litros<br>Nº de Programas:10 <br>Sist. de Limpeza:Pirolítica com 3 níveis: Eco, Normal e Plus <br>Classe Energética:A <br>Potência:3600 W<br>Altura:59,5 cm<br>Largura:59,4 cm<br>Profundidade:54,8 cm<br>Cor:Inox <br>Características:Visor LCD<BR>Comandos redondos fixos<BR>Relógio eletrónico com hora, alarme, programação do tempo de início e fim de cozedura<BR>Controlo da evolução do aquecimento<BR>Aquecimento rápido<BR>Sugestão automática da temperatura<BR>AutoPilot 30 programas automáticos<BR>Iluminação interior halogénea<BR>Turbina de arrefecimento<BR>Termosonda<BR>Bloqueio de segurança<BR>Indicador calor residual<BR>Interior da porta em vidro<BR>Raile independente para colocar em qualquer nível do forno <br>Acessórios Incluídos:Grelha<BR>Assadeira universal <br>Garantia:2 anos<br>",A,http://services.sorefoz.pt/redes/mostraretiqenerg.aspx?fich=31050791,Não,
31050792,"ENC.FORNO BOSCH MF.PIRO.PR-HBA5780B0",11,BOSCH,1,"GRANDES DOMÉSTICOS",90,"ENCASTRE - FORNOS",900094,"PIROLITICOS                                       ",",00","625,90","434,37",não,não,não,sim,HBA5780B0,"4242005056651 ","40,37","305,252",680,670,670,"http://services.sorefoz.pt/redes/imgredes2.aspx?IMG=31050792 ","Forno: Multifunções  <BR>Capacidade do Forno: 71 Litros<BR>Nº de Programas: 10  <BR>Sist. de Limpeza: Pirolítico  <BR>Classe Energética: A  <BR>Potência: 3600 W<BR>Altura: 59,5 cm<BR>Largura: 59,4 cm<BR>Profundidade: 54,8 cm<BR>Cor: Vidro preto  <BR>Garantia: 2 anos<BR>-","Forno:Multifunções <br>Capacidade do Forno:71 Litros<br>Nº de Programas:10 <br>Sist. de Limpeza:Pirolítico <br>Classe Energética:A <br>Potência:3600 W<br>Altura:59,5 cm<br>Largura:59,4 cm<br>Profundidade:54,8 cm<br>Cor:Vidro preto <br>Características:Display LCD com luz branca<BR>Comandos ocultos<BR>Relógio eletrónico programável com início e paragem de cocção<BR>Iluminação halogénea<BR>Sistema de aquecimento 3D profissional<BR>Função Sprint: pré-aquecimento rápido<BR>Receitas Gourmet: 30 receitas automáticas<BR>Proposta de temperatura para cada função<BR>Raile independente para colocar em qualquer nível do forno <br>Garantia:2 anos<br>",A,http://services.sorefoz.pt/redes/mostraretiqenerg.aspx?fich=31050792,Não,
31050793,"ENC.FORNO BOSCH MF.PIRO.BR-HBA5780W0",11,BOSCH,1,"GRANDES DOMÉSTICOS",90,"ENCASTRE - FORNOS",900094,"PIROLITICOS                                       ",",00","625,90","421,33",não,não,não,sim,HBA5780W0,"4242005056699 ","41,7","305,252",670,670,680,"http://services.sorefoz.pt/redes/imgredes2.aspx?IMG=31050793 ","Forno: Multifunções  <BR>Capacidade do Forno: 71 Litros<BR>Nº de Programas: 10  <BR>Sist. de Limpeza: Pirolítico  <BR>Classe Energética: A  <BR>Potência: 3600 W<BR>Altura: 59,5 cm<BR>Largura: 59,4 cm<BR>Profundidade: 54,8 cm<BR>Cor: Vidro Branco  <BR>Acessórios Incluídos: Tabuleiro esmaltado<BR>Grelha<BR>Assadeira universal  <BR>Garantia: 2 anos<BR>-","Forno:Multifunções <br>Capacidade do Forno:71 Litros<br>Nº de Programas:10 <br>Sist. de Limpeza:Pirolítico <br>Classe Energética:A <br>Potência:3600 W<br>Altura:59,5 cm<br>Largura:59,4 cm<br>Profundidade:54,8 cm<br>Cor:Vidro Branco <br>Características:Visor LCD branco<BR>Comandos embutíveis<BR>Relógio eletrónico com hora, alarme, programação do tempo de início e fim de cozedura<BR>Sugestão automática da temperatura<BR>Aquecimento rápido<BR>Controlo da evolução do aquecimento<BR>AutoPilot 30 programas automáticos<BR>Iluminação halogénea<BR>Desligar automático<BR>Indicador de calor residual<BR>Bloqueio de segurança<BR>Bloqueio eletrónico da porta<BR>Turbina de arrefecimento<BR>Puxador em inox <br>Acessórios Incluídos:Tabuleiro esmaltado<BR>Grelha<BR>Assadeira universal <br>Garantia:2 anos<br>",A,http://services.sorefoz.pt/redes/mostraretiqenerg.aspx?fich=31050793,Não,
31050794,"ENC.FORNO BOSCH MF.PIR.IX-HBA5780S00",11,BOSCH,1,"GRANDES DOMÉSTICOS",90,"ENCASTRE - FORNOS",900094,"PIROLITICOS                                       ",",00","625,90","434,37",não,não,não,sim,HBA5780S00,"4242005056675 ",40,"291,852",660,660,670,"http://services.sorefoz.pt/redes/imgredes2.aspx?IMG=31050794 ","Forno: Multifunções  <BR>Capacidade do Forno: 71 Litros<BR>Nº de Programas: 10  <BR>Sist. de Limpeza: Pirolítico  <BR>Classe Energética: A  <BR>Potência: 3600 W<BR>Altura: 59,5 cm<BR>Largura: 59,4 cm<BR>Profundidade: 54,8 cm<BR>Cor: Aço inox / Vidro preto  <BR>Acessórios Incluídos: Grelha profissional<BR>Tabuleiro esmaltado<BR>Tabuleiro universal  <BR>Garantia: 2 anos<BR>-","Forno:Multifunções <br>Capacidade do Forno:71 Litros<br>Nº de Programas:10 <br>Sist. de Limpeza:Pirolítico <br>Classe Energética:A <br>Potência:3600 W<br>Altura:59,5 cm<br>Largura:59,4 cm<br>Profundidade:54,8 cm<br>Cor:Aço inox / Vidro preto <br>Características:Display LCD com luz branca<BR>Comandos ocultos<BR>Relógio eletrónico programável com início e paragem de cocção<BR>Iluminação halogénea<BR>Sistema de aquecimento 3D profissional<BR>Função Sprint: pré-aquecimento rápido<BR>Receitas Gourmet: 30 receitas automáticas<BR>Proposta de temperatura para cada função<BR>Raile independente para colocar em qualquer nível do forno <br>Acessórios Incluídos:Grelha profissional<BR>Tabuleiro esmaltado<BR>Tabuleiro universal <br>Garantia:2 anos<br>",A,http://services.sorefoz.pt/redes/mostraretiqenerg.aspx?fich=31050794,Não,
31050795,"ENC.FORNO BOSCH MF.PIR.IX-HBA574BR00",11,BOSCH,1,"GRANDES DOMÉSTICOS",90,"ENCASTRE - FORNOS",900094,"PIROLITICOS                                       ",",00","550,90","370,75",não,não,não,não,HBA574BR00,"4242005069354 ","40,3","300,696",680,670,660,"http://services.sorefoz.pt/redes/imgredes2.aspx?IMG=31050795 ","Forno: Multifunções  <BR>Capacidade do Forno: 71 Litros<BR>Nº de Programas: 7  <BR>Sist. de Limpeza: Pirolítica com 3 níveis: Eco, Normal e Plus  <BR>Classe Energética: A  <BR>Potência: 3600 W<BR>Altura: 59,5 cm<BR>Largura: 59,4 cm<BR>Profundidade: 54,8 cm<BR>Cor: Inox  <BR>Acessórios Incluídos: Tabuleiro esmaltado<BR>Grelha<BR>Assadeira universal  <BR>Garantia: 2 anos<BR>-","Forno:Multifunções <br>Capacidade do Forno:71 Litros<br>Nº de Programas:7 <br>Sist. de Limpeza:Pirolítica com 3 níveis: Eco, Normal e Plus <br>Classe Energética:A <br>Potência:3600 W<br>Altura:59,5 cm<br>Largura:59,4 cm<br>Profundidade:54,8 cm<br>Cor:Inox <br>Características:Visor LED<BR>Comandos redondos fixos<BR>Relógio eletrónico com hora, alarme, programação do tempo de início e fim de cozedura<BR>Controlo da evolução do aquecimento<BR>Aquecimento rápido<BR>AutoPilot 10 programas automáticos<BR>Porta do forno com abertura abatível<BR>Iluminação interior halogénea<BR>Turbina de arrefecimento<BR>Puxador em inox<BR>Bloqueio eletrónico da porta<BR>Bloqueio de segurança<BR>Desligar de segurança <br>Acessórios Incluídos:Tabuleiro esmaltado<BR>Grelha<BR>Assadeira universal <br>Garantia:2 anos<br>",A,http://services.sorefoz.pt/redes/mostraretiqenerg.aspx?fich=31050795,Não,
